{
  "meta": {
    "supplierName": "Serco Group plc",
    "slug": "serco-group",
    "generatedAt": "2026-04-11T09:00:00Z",
    "generatedBy": "Agent 2 — Market & Competitive Intelligence",
    "version": "1.0",
    "depthMode": "standard",
    "refreshDue": {
      "procurementData": "2026-04-18",
      "frameworkData": "2026-05-11",
      "corporateDisclosures": "2026-05-11",
      "weakSignals": "2026-04-25"
    },
    "versionLog": [
      {
        "version": "1.0",
        "date": "2026-04-11",
        "summary": "Initial dossier. Procurement data from FTS (127 awards across Serco entities). Companies House enrichment. FY2025 annual results. Leadership updates to March 2026. ESG and delivery scrutiny from public sources."
      }
    ]
  },

  "identity": {
    "legalName": "SERCO LIMITED",
    "tradingNames": ["Serco", "Serco Group", "Serco Leisure"],
    "parentGroup": "Serco Holdings Limited (intermediate), Serco Group plc (ultimate listed parent)",
    "companiesHouseNo": "00242246",
    "headquarters": "Hook, Hampshire, UK",
    "ownershipType": "listed",
    "archetype": "bpo_bps",
    "crownRepresentative": false,
    "strategicSupplierCentral": true,
    "strategicSupplierLocalGov": false,
    "employeeCount": 55000,
    "annualRevenue": "\u00a34.9bn FY2025 (Group)",
    "ukPublicSectorRevenue": "Estimated \u00a32.0-2.5bn (estimated \u2014 UK & Europe division plus UK elements of Defence, not separately disclosed)"
  },

  "scores": {
    "sectorStrength": {
      "overall": 78,
      "completeness": {
        "factorsEvidenced": 7,
        "factorsTotal": 7,
        "incomplete": false
      },
      "factors": [
        {
          "name": "Award velocity",
          "weight": 0.20,
          "value": 80,
          "evidenced": true,
          "evidenceSummary": "127 awards across Serco entities in FTS database; 42 awards for SERCO LIMITED alone totalling \u00a37.6bn. Consistent winning across multiple sectors including recent DWP and MOD awards.",
          "confidence": 90,
          "weighted": 16.0
        },
        {
          "name": "Incumbent density",
          "weight": 0.20,
          "value": 82,
          "evidenced": true,
          "evidenceSummary": "Incumbent on major long-running contracts: DWP Functional Assessment Services, MOD Defence Marine Services, MoJ prison operations, TfL London Cycle Hire, NHS Total FM. >90% contract retention rate reported.",
          "confidence": 85,
          "weighted": 16.4
        },
        {
          "name": "Framework presence",
          "weight": 0.15,
          "value": 75,
          "evidenced": true,
          "evidenceSummary": "Present on CCS Space Technology Solutions, YPO Apprenticeships, NHS LPP Total FM framework. 33 awards via Crown Commercial Service alone. Framework coverage strong in BPO/FM but less visible in digital/IT frameworks.",
          "confidence": 82,
          "weighted": 11.25
        },
        {
          "name": "Buyer coverage",
          "weight": 0.15,
          "value": 85,
          "evidenced": true,
          "evidenceSummary": "Awards from DWP, MOD, MoJ, Home Office, Cabinet Office, UKHSA, NHS, TfL, BBC, DfE, local authorities. Broad cross-sector buyer base spanning central government, defence, health, justice, and transport.",
          "confidence": 90,
          "weighted": 12.75
        },
        {
          "name": "Delivery credentials",
          "weight": 0.10,
          "value": 65,
          "evidenced": true,
          "evidenceSummary": "Long-running contracts evidence delivery capability (MOD marine services since 1990s, prison operations). However NAO asylum accommodation findings and historical SFO settlement temper the score. Mixed signal: high retention but documented underperformance on specific contracts.",
          "confidence": 74,
          "weighted": 6.5
        },
        {
          "name": "Financial resilience",
          "weight": 0.10,
          "value": 78,
          "evidenced": true,
          "evidenceSummary": "Revenue \u00a34.9bn, operating profit ~\u00a3272m, guided \u00a3300m for 2026. Order book \u00a314.5bn (+9% YoY). Pipeline \u00a312.1bn (decade high). Share buyback \u00a375m signals confidence. Northrop Grumman MT&S acquisition funded. Margin ~5.5%.",
          "confidence": 81,
          "weighted": 7.8
        },
        {
          "name": "Partner ecosystem",
          "weight": 0.10,
          "value": 68,
          "evidenced": true,
          "evidenceSummary": "Northrop Grumman MT&S acquisition strengthens satellite/training tech. Framework teaming with SMEs on YPO apprenticeships. Defence partnerships evident. However, specific named alliance partnerships less visible than for systems integrators.",
          "confidence": 65,
          "weighted": 6.8
        }
      ]
    },

    "competitorThreat": {
      "overall": 74,
      "completeness": {
        "factorsEvidenced": 5,
        "factorsTotal": 5,
        "incomplete": false
      },
      "factors": [
        {
          "name": "Sector strength",
          "weight": 0.35,
          "value": 78,
          "evidenced": true,
          "evidenceSummary": "Sector Strength Score of 78 \u2014 strong incumbent across BPO, citizen services, FM, defence support, and justice.",
          "confidence": 82,
          "weighted": 27.3
        },
        {
          "name": "Commercial aggressiveness",
          "weight": 0.20,
          "value": 72,
          "evidenced": true,
          "evidenceSummary": "Mix of cost-plus and fixed-price contracts. Operating margin ~5.5% suggests competitive but not margin-destructive pricing. Management margin on pass-through solutions indicates willingness to take thin-margin gateway deals. Moving toward outcome-based contracting.",
          "confidence": 70,
          "weighted": 14.4
        },
        {
          "name": "Route-to-market advantage",
          "weight": 0.15,
          "value": 70,
          "evidenced": true,
          "evidenceSummary": "33 awards via CCS. Present on major frameworks. \u00a310.5bn via selective procurement, \u00a35.9bn via limited, \u00a34.1bn via open. Strong use of restricted/selective routes indicates established buyer relationships and pre-qualification advantage.",
          "confidence": 85,
          "weighted": 10.5
        },
        {
          "name": "Relationship depth",
          "weight": 0.15,
          "value": 78,
          "evidenced": true,
          "evidenceSummary": "Long-running relationships with DWP (13 awards, \u00a33.3bn), MOD (9 awards, \u00a31.1bn), CCS (33 awards). Multi-contract relationships across multiple departments. >90% retention rate. Repeat buyer engagement is a defining characteristic.",
          "confidence": 85,
          "weighted": 11.7
        },
        {
          "name": "Brand trust",
          "weight": 0.15,
          "value": 65,
          "evidenced": true,
          "evidenceSummary": "Recognised name in UK public sector outsourcing. However, brand carries legacy baggage: SFO electronic tagging settlement (\u00a323m), NAO asylum findings, parliamentary EDMs citing delivery failures, COVID-era non-competitive award scrutiny. Trust is functional but not unblemished.",
          "confidence": 72,
          "weighted": 9.75
        }
      ]
    },

    "vulnerability": {
      "overall": 52,
      "completeness": {
        "factorsEvidenced": 7,
        "factorsTotal": 7,
        "incomplete": false
      },
      "factors": [
        {
          "name": "Margin pressure",
          "weight": 0.20,
          "value": 45,
          "evidenced": true,
          "evidenceSummary": "Operating margin ~5.5% is thin for the complexity of services delivered. Fixed-price contracts in inflationary environments create margin risk. However, guided improvement to \u00a3300m profit in 2026 and strong cash conversion from negative working capital suggest margin is managed, not distressed.",
          "confidence": 76,
          "weighted": 9.0
        },
        {
          "name": "Contract friction",
          "weight": 0.20,
          "value": 62,
          "evidenced": true,
          "evidenceSummary": "NAO May 2025: \u00a34m deducted for Home Office asylum accommodation underperformance. Historical SFO \u00a323m tagging settlement. Parliamentary EDMs citing delivery failures. COVID non-competitive award criticism. Multiple documented performance issues, though retention remains >90%.",
          "confidence": 78,
          "weighted": 12.4
        },
        {
          "name": "Concentration risk",
          "weight": 0.15,
          "value": 50,
          "evidenced": true,
          "evidenceSummary": "Revenue spread across DWP, MOD, MoJ, NHS, Home Office, CCS and others \u2014 no single buyer dominates. However, UK public sector as a whole represents a large proportion of group revenue. Diversification across sectors is good; geographic and segment concentration is moderate.",
          "confidence": 72,
          "weighted": 7.5
        },
        {
          "name": "Delivery complexity",
          "weight": 0.15,
          "value": 55,
          "evidenced": true,
          "evidenceSummary": "55,000 employees across multiple sectors and geographies. Service lines span prisons, citizen assessments, marine services, facilities management, cycle hire, space technology. Breadth creates execution complexity. Asylum accommodation issues suggest capacity limits in surge scenarios.",
          "confidence": 68,
          "weighted": 8.25
        },
        {
          "name": "Restructuring signal",
          "weight": 0.10,
          "value": 55,
          "evidenced": true,